{
  "$schema": "https://json-schema.org/draft/2020-12/schema",
  "$id": "https://gammascope.local/schemas/analytics-snapshot.schema.json",
  "title": "AnalyticsSnapshot",
  "type": "object",
  "additionalProperties": false,
  "required": [
    "schema_version",
    "session_id",
    "mode",
    "symbol",
    "expiry",
    "snapshot_time",
    "spot",
    "forward",
    "discount_factor",
    "risk_free_rate",
    "dividend_yield",
    "source_status",
    "freshness_ms",
    "coverage_status",
    "scenario_params",
    "rows"
  ],
  "properties": {
    "schema_version": { "type": "string", "const": "1.0.0" },
    "session_id": { "type": "string", "minLength": 1 },
    "mode": { "type": "string", "enum": ["live", "replay", "scenario"] },
    "symbol": { "type": "string", "const": "SPX" },
    "expiry": { "type": "string", "pattern": "^\\d{4}-\\d{2}-\\d{2}$" },
    "snapshot_time": { "type": "string", "format": "date-time" },
    "spot": { "type": "number", "exclusiveMinimum": 0 },
    "forward": { "type": "number", "exclusiveMinimum": 0 },
    "discount_factor": { "type": "number", "exclusiveMinimum": 0, "maximum": 1.5 },
    "risk_free_rate": { "type": "number" },
    "dividend_yield": { "type": "number" },
    "source_status": {
      "type": "string",
      "enum": ["starting", "connected", "degraded", "disconnected", "stale", "error"]
    },
    "freshness_ms": { "type": "integer", "minimum": 0 },
    "coverage_status": { "type": "string", "enum": ["full", "partial", "empty"] },
    "scenario_params": {
      "type": ["object", "null"],
      "additionalProperties": false,
      "properties": {
        "spot_shift_points": { "type": "number" },
        "vol_shift_points": { "type": "number" },
        "time_shift_minutes": { "type": "number" }
      }
    },
    "rows": {
      "type": "array",
      "items": {
        "type": "object",
        "additionalProperties": false,
        "required": [
          "contract_id",
          "right",
          "strike",
          "bid",
          "ask",
          "mid",
          "open_interest",
          "custom_iv",
          "custom_gamma",
          "custom_vanna",
          "ibkr_iv",
          "ibkr_gamma",
          "ibkr_vanna",
          "iv_diff",
          "gamma_diff",
          "calc_status",
          "comparison_status"
        ],
        "properties": {
          "contract_id": { "type": "string", "minLength": 1 },
          "right": { "type": "string", "enum": ["call", "put"] },
          "strike": { "type": "number", "exclusiveMinimum": 0 },
          "bid": { "type": ["number", "null"] },
          "ask": { "type": ["number", "null"] },
          "mid": { "type": ["number", "null"] },
          "last": { "type": ["number", "null"] },
          "bid_size": { "type": ["number", "null"], "minimum": 0 },
          "ask_size": { "type": ["number", "null"], "minimum": 0 },
          "volume": { "type": ["number", "null"], "minimum": 0 },
          "open_interest": { "type": ["integer", "null"], "minimum": 0 },
          "custom_iv": { "type": ["number", "null"], "minimum": 0 },
          "custom_gamma": { "type": ["number", "null"] },
          "custom_vanna": { "type": ["number", "null"] },
          "ibkr_iv": { "type": ["number", "null"] },
          "ibkr_delta": { "type": ["number", "null"] },
          "ibkr_gamma": { "type": ["number", "null"] },
          "ibkr_vega": { "type": ["number", "null"] },
          "ibkr_theta": { "type": ["number", "null"] },
          "ibkr_vanna": { "type": ["number", "null"] },
          "iv_diff": { "type": ["number", "null"] },
          "gamma_diff": { "type": ["number", "null"] },
          "calc_status": {
            "type": "string",
            "enum": [
              "ok",
              "missing_quote",
              "invalid_quote",
              "below_intrinsic",
              "vol_out_of_bounds",
              "stale_underlying",
              "solver_failed",
              "out_of_model_scope"
            ]
          },
          "comparison_status": {
            "type": "string",
            "enum": ["ok", "missing", "stale", "outside_tolerance", "not_supported"]
          }
        }
      }
    }
  }
}
