{
  "schema_version": "1.0.0",
  "session_id": "seed-spx-2026-04-23",
  "mode": "replay",
  "symbol": "SPX",
  "expiry": "2026-04-23",
  "snapshot_time": "2026-04-23T16:00:00Z",
  "spot": 5200.25,
  "forward": 5200.36,
  "discount_factor": 0.999979,
  "risk_free_rate": 0.045,
  "dividend_yield": 0.0,
  "source_status": "connected",
  "freshness_ms": 500,
  "coverage_status": "partial",
  "scenario_params": null,
  "rows": [
    {
      "contract_id": "SPXW-2026-04-23-C-5120",
      "right": "call",
      "strike": 5120,
      "bid": 79.76,
      "ask": 80.96,
      "mid": 80.36,
      "open_interest": 2614,
      "custom_iv": 0.2004,
      "custom_gamma": 2.4e-05,
      "custom_vanna": -9.6e-05,
      "ibkr_iv": 0.2019,
      "ibkr_gamma": 2.4e-05,
      "ibkr_vanna": null,
      "iv_diff": -0.0015,
      "gamma_diff": 0.0,
      "calc_status": "ok",
      "comparison_status": "ok"
    },
    {
      "contract_id": "SPXW-2026-04-23-P-5120",
      "right": "put",
      "strike": 5120,
      "bid": 0.0,
      "ask": 0.1,
      "mid": 0.05,
      "open_interest": 2119,
      "custom_iv": 0.2004,
      "custom_gamma": 2.4e-05,
      "custom_vanna": -9.6e-05,
      "ibkr_iv": 0.1994,
      "ibkr_gamma": 2.4e-05,
      "ibkr_vanna": null,
      "iv_diff": 0.001,
      "gamma_diff": -0.0,
      "calc_status": "ok",
      "comparison_status": "ok"
    },
    {
      "contract_id": "SPXW-2026-04-23-C-5130",
      "right": "call",
      "strike": 5130,
      "bid": 69.76,
      "ask": 70.96,
      "mid": 70.36,
      "open_interest": 2376,
      "custom_iv": 0.1976,
      "custom_gamma": 9.9e-05,
      "custom_vanna": -0.000355,
      "ibkr_iv": 0.1991,
      "ibkr_gamma": 9.8e-05,
      "ibkr_vanna": null,
      "iv_diff": -0.0015,
      "gamma_diff": 1e-06,
      "calc_status": "ok",
      "comparison_status": "ok"
    },
    {
      "contract_id": "SPXW-2026-04-23-P-5130",
      "right": "put",
      "strike": 5130,
      "bid": 0.0,
      "ask": 0.1,
      "mid": 0.05,
      "open_interest": 1992,
      "custom_iv": 0.1976,
      "custom_gamma": 9.9e-05,
      "custom_vanna": -0.000355,
      "ibkr_iv": 0.1966,
      "ibkr_gamma": 0.0001,
      "ibkr_vanna": null,
      "iv_diff": 0.001,
      "gamma_diff": -1e-06,
      "calc_status": "ok",
      "comparison_status": "ok"
    },
    {
      "contract_id": "SPXW-2026-04-23-C-5140",
      "right": "call",
      "strike": 5140,
      "bid": 59.77,
      "ask": 60.97,
      "mid": 60.37,
      "open_interest": 2155,
      "custom_iv": 0.1948,
      "custom_gamma": 0.000359,
      "custom_vanna": -0.001118,
      "ibkr_iv": 0.1963,
      "ibkr_gamma": 0.000354,
      "ibkr_vanna": null,
      "iv_diff": -0.0015,
      "gamma_diff": 5e-06,
      "calc_status": "ok",
      "comparison_status": "ok"
    },
    {
      "contract_id": "SPXW-2026-04-23-P-5140",
      "right": "put",
      "strike": 5140,
      "bid": 0.0,
      "ask": 0.1,
      "mid": 0.05,
      "open_interest": 1871,
      "custom_iv": 0.1948,
      "custom_gamma": 0.000359,
      "custom_vanna": -0.001118,
      "ibkr_iv": 0.1938,
      "ibkr_gamma": 0.000363,
      "ibkr_vanna": null,
      "iv_diff": 0.001,
      "gamma_diff": -4e-06,
      "calc_status": "ok",
      "comparison_status": "ok"
    },
    {
      "contract_id": "SPXW-2026-04-23-C-5150",
      "right": "call",
      "strike": 5150,
      "bid": 49.82,
      "ask": 51.02,
      "mid": 50.42,
      "open_interest": 1951,
      "custom_iv": 0.192,
      "custom_gamma": 0.001118,
      "custom_vanna": -0.002943,
      "ibkr_iv": 0.1935,
      "ibkr_gamma": 0.001101,
      "ibkr_vanna": null,
      "iv_diff": -0.0015,
      "gamma_diff": 1.7e-05,
      "calc_status": "ok",
      "comparison_status": "ok"
    },
    {
      "contract_id": "SPXW-2026-04-23-P-5150",
      "right": "put",
      "strike": 5150,
      "bid": 0.01,
      "ask": 0.11,
      "mid": 0.06,
      "open_interest": 1757,
      "custom_iv": 0.192,
      "custom_gamma": 0.001118,
      "custom_vanna": -0.002943,
      "ibkr_iv": 0.191,
      "ibkr_gamma": 0.001131,
      "ibkr_vanna": null,
      "iv_diff": 0.001,
      "gamma_diff": -1.3e-05,
      "calc_status": "ok",
      "comparison_status": "ok"
    },
    {
      "contract_id": "SPXW-2026-04-23-C-5160",
      "right": "call",
      "strike": 5160,
      "bid": 39.97,
      "ask": 41.17,
      "mid": 40.57,
      "open_interest": 1769,
      "custom_iv": 0.1892,
      "custom_gamma": 0.002952,
      "custom_vanna": -0.006315,
      "ibkr_iv": 0.1907,
      "ibkr_gamma": 0.002908,
      "ibkr_vanna": null,
      "iv_diff": -0.0015,
      "gamma_diff": 4.4e-05,
      "calc_status": "ok",
      "comparison_status": "ok"
    },
    {
      "contract_id": "SPXW-2026-04-23-P-5160",
      "right": "put",
      "strike": 5160,
      "bid": 0.17,
      "ask": 0.27,
      "mid": 0.22,
      "open_interest": 1654,
      "custom_iv": 0.1892,
      "custom_gamma": 0.002952,
      "custom_vanna": -0.006315,
      "ibkr_iv": 0.1882,
      "ibkr_gamma": 0.002988,
      "ibkr_vanna": null,
      "iv_diff": 0.001,
      "gamma_diff": -3.5e-05,
      "calc_status": "ok",
      "comparison_status": "ok"
    },
    {
      "contract_id": "SPXW-2026-04-23-C-5170",
      "right": "call",
      "strike": 5170,
      "bid": 30.46,
      "ask": 31.55,
      "mid": 31.0,
      "open_interest": 1615,
      "custom_iv": 0.1864,
      "custom_gamma": 0.00652,
      "custom_vanna": -0.010635,
      "ibkr_iv": 0.1879,
      "ibkr_gamma": 0.006422,
      "ibkr_vanna": null,
      "iv_diff": -0.0015,
      "gamma_diff": 9.8e-05,
      "calc_status": "ok",
      "comparison_status": "ok"
    },
    {
      "contract_id": "SPXW-2026-04-23-P-5170",
      "right": "put",
      "strike": 5170,
      "bid": 0.6,
      "ask": 0.7,
      "mid": 0.65,
      "open_interest": 1568,
      "custom_iv": 0.1864,
      "custom_gamma": 0.00652,
      "custom_vanna": -0.010635,
      "ibkr_iv": 0.1854,
      "ibkr_gamma": 0.006598,
      "ibkr_vanna": null,
      "iv_diff": 0.001,
      "gamma_diff": -7.8e-05,
      "calc_status": "ok",
      "comparison_status": "ok"
    },
    {
      "contract_id": "SPXW-2026-04-23-C-5180",
      "right": "call",
      "strike": 5180,
      "bid": 21.67,
      "ask": 22.44,
      "mid": 22.05,
      "open_interest": 1490,
      "custom_iv": 0.1836,
      "custom_gamma": 0.01184,
      "custom_vanna": -0.013128,
      "ibkr_iv": 0.1851,
      "ibkr_gamma": 0.011663,
      "ibkr_vanna": null,
      "iv_diff": -0.0015,
      "gamma_diff": 0.000178,
      "calc_status": "ok",
      "comparison_status": "ok"
    },
    {
      "contract_id": "SPXW-2026-04-23-P-5180",
      "right": "put",
      "strike": 5180,
      "bid": 1.65,
      "ask": 1.75,
      "mid": 1.7,
      "open_interest": 1504,
      "custom_iv": 0.1836,
      "custom_gamma": 0.01184,
      "custom_vanna": -0.013128,
      "ibkr_iv": 0.1826,
      "ibkr_gamma": 0.011982,
      "ibkr_vanna": null,
      "iv_diff": 0.001,
      "gamma_diff": -0.000142,
      "calc_status": "ok",
      "comparison_status": "ok"
    },
    {
      "contract_id": "SPXW-2026-04-23-C-5190",
      "right": "call",
      "strike": 5190,
      "bid": 13.98,
      "ask": 14.48,
      "mid": 14.23,
      "open_interest": 1405,
      "custom_iv": 0.1808,
      "custom_gamma": 0.017364,
      "custom_vanna": -0.009919,
      "ibkr_iv": 0.1823,
      "ibkr_gamma": 0.017104,
      "ibkr_vanna": null,
      "iv_diff": -0.0015,
      "gamma_diff": 0.00026,
      "calc_status": "ok",
      "comparison_status": "ok"
    },
    {
      "contract_id": "SPXW-2026-04-23-P-5190",
      "right": "put",
      "strike": 5190,
      "bid": 3.8,
      "ask": 3.94,
      "mid": 3.87,
      "open_interest": 1473,
      "custom_iv": 0.1808,
      "custom_gamma": 0.017364,
      "custom_vanna": -0.009919,
      "ibkr_iv": 0.1798,
      "ibkr_gamma": 0.017573,
      "ibkr_vanna": null,
      "iv_diff": 0.001,
      "gamma_diff": -0.000208,
      "calc_status": "ok",
      "comparison_status": "ok"
    },
    {
      "contract_id": "SPXW-2026-04-23-C-5200",
      "right": "call",
      "strike": 5200,
      "bid": 7.93,
      "ask": 8.21,
      "mid": 8.07,
      "open_interest": 1370,
      "custom_iv": 0.178,
      "custom_gamma": 0.020165,
      "custom_vanna": -0.000362,
      "ibkr_iv": 0.1795,
      "ibkr_gamma": 0.019863,
      "ibkr_vanna": null,
      "iv_diff": -0.0015,
      "gamma_diff": 0.000302,
      "calc_status": "ok",
      "comparison_status": "ok"
    },
    {
      "contract_id": "SPXW-2026-04-23-P-5200",
      "right": "put",
      "strike": 5200,
      "bid": 7.58,
      "ask": 7.85,
      "mid": 7.71,
      "open_interest": 1490,
      "custom_iv": 0.178,
      "custom_gamma": 0.020165,
      "custom_vanna": -0.000362,
      "ibkr_iv": 0.177,
      "ibkr_gamma": 0.020407,
      "ibkr_vanna": null,
      "iv_diff": 0.001,
      "gamma_diff": -0.000242,
      "calc_status": "ok",
      "comparison_status": "ok"
    },
    {
      "contract_id": "SPXW-2026-04-23-C-5210",
      "right": "call",
      "strike": 5210,
      "bid": 4.05,
      "ask": 4.19,
      "mid": 4.12,
      "open_interest": 1353,
      "custom_iv": 0.1812,
      "custom_gamma": 0.017686,
      "custom_vanna": 0.009442,
      "ibkr_iv": 0.1827,
      "ibkr_gamma": 0.017421,
      "ibkr_vanna": null,
      "iv_diff": -0.0015,
      "gamma_diff": 0.000265,
      "calc_status": "ok",
      "comparison_status": "ok"
    },
    {
      "contract_id": "SPXW-2026-04-23-P-5210",
      "right": "put",
      "strike": 5210,
      "bid": 13.52,
      "ask": 14.01,
      "mid": 13.76,
      "open_interest": 1525,
      "custom_iv": 0.1812,
      "custom_gamma": 0.017686,
      "custom_vanna": 0.009442,
      "ibkr_iv": 0.1802,
      "ibkr_gamma": 0.017899,
      "ibkr_vanna": null,
      "iv_diff": 0.001,
      "gamma_diff": -0.000212,
      "calc_status": "ok",
      "comparison_status": "ok"
    },
    {